uri,lang,isDuplicate,date,time,dateTime,dateTimePub,dataType,sim,url,title,body,source_uri,source_dataType,source_title,authors,sentiment,wgt,relevance,image,eventUri
8155607459,eng,False,2024-05-31,18:31:20,2024-05-31T18:31:20Z,2024-05-31T18:30:30Z,news,0.0,https://www.hartenergy.com/exclusives/energy-transition-motion-week-may-31-2024-209339,"Energy Transition in Motion (Week of May 31, 2024) | Hart Energy","The U.S. Bureau of Ocean Energy Management (BOEM) has offered a floating wind research lease to the state of Maine after completing an environmental review and finding no significant impact, it said May 28.

The move enables the offshore wind research lease, located about 28 nautical miles off Maine, to advance. Maine has 30 calendar days to accept, reject or request modifications to the lease.

""Floating wind technology can make offshore wind a reality in the Gulf of Maine,"" said BOEM Director Elizabeth Klein. ""BOEM will continue to work in partnership with the state of Maine as we move forward to facilitate the responsible development of offshore wind in this region, as well as the deployment of floating offshore wind technology nationwide.""

The state requested the research lease in October 2021 to study floating offshore wind energy technology and its deployment. If developed, the site would include up to 12 floating offshore wind turbines capable of generating up to 144 megawatts (MW) of renewable energy, according to BOEM.

The U.S. aims to have 30 gigawatts (GW) of offshore wind capacity by 2030 and 15 GW of floating wind capacity by 2035.

Here's a look at other renewable energy news this week.

Waga Energy and Engie signed a biomethane purchase agreement (BPA) for renewable natural gas produced at the Veolia site in Claye-Souilly near Paris, Waga said on May 29.

The 13-year contract, which is the longest BPA signed to date in France, values the biomethane at a higher price than the subsidized tariff, Waga said in a news release. ""This enables Waga Energy to secure financing for the production unit through a long-term credit facility with the banks CIC and Arkéa Banque Entreprises et Institutionnels,"" the company said.

The contract took effect May 1.

Up to 120 gigawatt hours (GWh) of RNG, equivalent to the consumption of 20,000 households, is produced annually at the Veolia site, according to Waga.

""Veolia is a key player in the production of bioenergy, already producing 1.6 terawatt-hour of biogas from waste anaerobic digestion in France alone,"" Veolia CEO Estelle Brachlianoff said. ""Through this partnership with Waga Energy and Engie, we are contributing to the development of a genuine green gas production industry at the European level, essential for the ecological transformation.""

Energy storage provider Torus will provide 26 megawatt hours (MWh) of energy storage capacity across a portion of real estate developer Gardner Group's portfolio, equivalent to powering nearly 1,000 homes for a full day.

Under a landmark deal, Torus will install its Torus Station energy storage and management system at Gardner's multiple properties, the company announced May 29.

The Torus Stations will integrate ""advanced"" battery and flywheel energy storage systems with Torus' software platform.

Torus said the integration enables energy management and demand response capabilities and connects renewable energy sources and electric vehicle charging infrastructure.

The systems will be manufactured at Torus' South Salt Lake City, Utah, facility and are expected to begin installation in fourth-quarter 2024 with completion by first-quarter 2026.

""Partnering with Torus allows us to optimize our energy management, reduce our carbon footprint and provide enhanced value to our tenants,"" said Christian Gardner, CEO of Gardner Group. ""We look forward to the positive impact this project will have on our properties and the broader community.""

Verbund, an Austria-based electricity company, partnered with TotalEnergies and EREN Groupe joint venture company TE H2 to study implementation of a green hydrogen project in Tunisia.

Called H2 Notos, hydrogen would be produced with electrolyzers powered by onshore wind and solar energy with desalinated sea water, TotalEnergies said May 28. Ambitions are to initially produce 200,000 tons of green hydrogen per year, potentially scaling up to 1 million tons per year.

""H2 Notos has the potential to become a significant supplier of green hydrogen for Europe while fostering significant jobs creation in Tunisia,"" said TE H2 CEO David Corchia. ""We are entering into a phase of greenfield development and major technical work to assess the feasibility of the project and we will need to further deepen the highly constructive and fruitful collaboration we have enjoyed with the national and local authorities through H2 Notos.""

The hydrogen will access the European market via the SoutH2 Corridor hydrogen pipeline, which is expected to be commissioned around 2030. The pipeline connects North Africa to Italy, Austria and Germany.

Verbund will coordinate the transport of hydrogen toward Central Europe, according to the release, while TE H2 and Verbund will jointly develop, finance, construct and operate the project, according to the release.

Italy, Germany and Austria have signed an agreement to cooperate on the development of a network to transport hydrogen from the southern Mediterranean to northern Europe, the energy ministries of the three countries said on May 30.

The official announcement marks a concrete step in the European Union's strategy to secure renewable hydrogen supplies by 2030 to help decarbonize its most polluting industries.

""The Southern Hydrogen Corridor will provide renewable hydrogen imports from North Africa via southern Italy and further connect to the major hydrogen demand hubs in Italy, Austria and Germany,"" the German ministry said in a statement.

The link dubbed SoutH2, which last year won priority status from the European Commission, is considered important to develop a European market for renewable fuel.

A group of companies, including Italian gas grid operator Snam, have teamed up to build the SoutH2 pipeline by the beginning of the next decade, with a financial commitment of more than 4 billion euros ($4.3 billion).

EDP Renewables North America has completed its 175-MW Crooked Lake Solar Park in Arkansas, the company said May 29.

Located near Blytheville in Mississippi County, the solar park is expected to generate enough electricity to power the equivalent of about 30,000 Arkansas homes annually. The solar park is the latest utility-scale addition for EDPR, which now has facilities in 19 U.S. states.

""We're proud to continue our expansion in the South with a focus on serving the clean energy needs of Arkansas,"" stated EDP Renewables North America CEO Sandhya Ganapathy. ""By providing sustainable energy to Mississippi County and the surrounding area, we are generating economic growth and grid stability for generations to come in the region.""

The solar park, located on an approximately 1,800-acre site, utilizes single-axis tracking photovoltaic panels.

Florida-based Apricus Generation has acquired a controlling interest in Nexus Renewables, a solar and energy storage developer, according to a May 29 news release.

Nexus, which has a pipeline of about 500 MW of solar and energy storage projects in North America, is the first strategic acquisition of Apricus. The holding company launched earlier this year.

""As with many independent developers, Nexus has more project opportunities than access to capital,"" said Gautam Chandra, executive chairman and co-founder of Apricus Generation. ""By joining Apricus, they now have access to capital and expertise that will allow them to execute on their pipeline.""

Adding Green: HighPeak, Priority Power Advance WildHorse Solar

Apricus Generation Acquires Solar, Storage Developer Nexus Renewables

New Jersey officials said the state will receive $125 million from a legal settlement with Denmark's Ørsted over the company's cancellation last year of two offshore wind farm projects.

The New Jersey Board of Public Utilities said in a statement that the funds will be used for investments in wind component manufacturing facilities and wind farms.

The settlement comes nearly seven months after Ørsted said it would stop developing the Ocean Wind 1 and 2 projects off the coast of New Jersey as it struggled with soaring costs and supply chain delays.

The cancellations triggered an angry response from New Jersey Governor Phil Murphy, who is banking on offshore wind to help achieve the state's climate change goals.

His administration said it would speed up the state's plans to procure additional offshore wind capacity by soliciting bids for new projects in the second quarter of 2025, more than a year ahead of schedule.

The utility regulator also said it would pause an offshore wind transmission planning effort with the regional power grid operator, PJM Interconnection, while it considers the impact of a new rule from the Federal Energy Regulatory Commission that reforms how large power lines are approved and paid for.",hartenergy.com,news,Hart Energy,,0.2549019607843137,454876280,1,https://www.hartenergy.com/sites/default/files/styles/max_650x650/public/image/2024/05/et-roundup_0.jpg?itok=wJmtyrgu,
8154887271,eng,False,2024-05-31,10:08:08,2024-05-31T10:08:08Z,2024-05-31T10:05:07Z,news,0.5176470875740051,https://www.whatech.com/og/markets-research/transport/834136-electric-vehicle-battery-recycling-market-booming-growth-ahead,Electric Vehicle Battery Recycling Market: Booming Growth Ahead As Revealed In New Report,"Increase in demand for zero-emission vehicles and the easy availability of finite metal resources propel the growth of the global electric vehicle battery recycling market

The growth of the global Electric Vehicle Battery Recycling Market is driven by the growing demand for zero-emission vehicles and recycled products & materials. Market growth is further supplemented by the availability of finite metal resources and the surge in middle-class employment. However, the high-cost to initialize recycling plants and the rise in re-use of EV batteries hamper the market growth. Nonetheless, the increase in subsidies to encourage battery recycling along with high recycling gap would provide lucrative opportunities for emerging market players in the near future.

Request Sample Pages: www.alliedmarketresearch.com/request-sample/5216

Recycling of EV batteries involves processes such as collecting, dismantling, processing, and more. Approximately, 15 jobs are created per thousand tons of lithium-ion battery waste, for collecting, dismantling, and recycling these batteries. Out of these 15 jobs, 20% of jobs are for the recycling of batteries and 80% are for collecting and dismantling lithium-ion batteries. This increases the job opportunities in the industry. This growth might be fueled by the government initiatives such as subsidies on the sales of electric vehicles, which eventually result in increase in sales of the battery of the electric vehicle. Therefore, increase in job opportunities involved in the recycling process of these batteries drives the electric vehicle battery recycling market growth.

Key Market Players:

LI-CYCLE CORP., G & P BATTERIES, FLORIDIENNE (SNAM S.A.S.), RETRIEV TECHNOLOGIES, UMICORE, SITRASA, ACCUREC RECYCLING GMBH, BATTERY SOLUTIONS, RECUPYL, AMERICAN MANGANESE INC.

By application, the electric buses segment is expected to dominate the global market during the forecast period and occupy almost half of the total share. This is attributed to the growing adoption of alternative fuel technologies in commercial vehicles such as buses, which offer zero emission, better acceleration, and quiet operation. However, the energy storage systems segment is projected to register the highest CAGR of 47.8% from 2018 to 2025, on account of remanufacturing of lithium-ion batteries to provide a second-life with 70-80% charging capabilities.

Buy Full Report: www.alliedmarketresearch.com/checkou...df274be698

However, electric vehicles require high-performance batteries to operate efficiently. Hence, such batteries, which are removed from the vehicles are able to charge and discharge to a specific point, which is around 70% to 80%. Instead of recycling these batteries which have reached its end of the life stage and are removed from the vehicle, the battery cells can be re manufactured and the cells can be given a second life in storage applications. For instance, Toyota and Chubu Electric Power Co. will be constructing a large-capacity storage battery system that reuses recycled batteries from Toyota electric vehicles to construct storage battery system. This hampers the growth of the electric vehicle battery recycling market.

Regional Analysis:

LAMEA is expected to grow at the fastest CAGR of 46.1% during the forecast period, owing to the high adoption rate of advanced electric vehicle systems in commercial vehicles. Moreover, the rise in vehicle emission standards in this region and growth in demand for fuel-efficient and eco-friendly technologies supplement the growth. Meanwhile, Asia-Pacific is anticipated to remain the dominant region by 2025, generating almost half of the global revenue. This is due to high adoption rates of smart mobility services, increased government regulations, surge in fuel prices, and rise in trend toward adopting non-fossil fuel-based vehicles.

Get Customized Report: www.alliedmarketresearch.com/request...ation/5216

Increase in global concerns regarding the negative effect of climate change along with alarming pollution levels recorded in the major cities have created a significant demand for electric vehicles. The demand for fuel-efficient vehicles has increased recently owing to rise in price of petrol and diesel. Thus, these factors increase the need for advanced fuel-efficient technologies, leading to surge in demand for electrically powered vehicles for travel, which generate demand for the batteries. These batteries are recycled once they reach end of their life. The first batch of batteries from electric and hybrid vehicles have reached their retirement age. The total number of batteries retired from electric bus and car equals to around 55,000 units and is expected to be recycled in 2018. Thus, increase in demand for electric vehicles drives the growth of the EV battery recycling market.

News From Allied Market Research

Category: Industry Reports & Market Analysis Profile: Allied Market Research is a global market research and business consulting wing of Allied Analytics LLP based in Portland, Oregon. Allied Market Research provides global enterprises and medium and small businesses with unmatched quality ""Market Research Reports"" and ""Business Intelligence Solutions."" AMR's goal is to provide business insights and consulting to assist its clients in making strategic business decisions and achieving sustainable growth in their respective market domains. Our marke ... This email address is being protected from spambots. You need JavaScript enabled to view it.",whatech.com,news,WhaTech,David Correa,0.3490196078431373,454846088,1,,eng-9609466
8154860930,eng,False,2024-05-31,09:50:23,2024-05-31T09:50:23Z,2024-05-31T09:49:35Z,news,0.8823529481887817,https://www.poandpo.com/politics/italy-germany-and-austria-sign-cooperation-deal-on-south2-pipeline,"Italy, Germany and Austria sign cooperation deal on SoutH2 pipeline","""The Southern Hydrogen Corridor will provide renewable hydrogen imports from North Africa via southern Italy and further connect to the major hydrogen demand hubs in Italy, Austria and Germany,"" the German ministry said in a statement.

The link dubbed SoutH2, which last year won priority status from the European Commission, is considered important to develop a European market for the renewable fuel.

A group of companies including Italian gas grid operator Snam has teamed up to build the SoutH2 pipeline by the beginning of the next decade, with a financial commitment of more than €4 billion (US$4.3 billion).

""The southern corridor will play an important role, especially in supplying the southern German states with green hydrogen,"" Germany's Minister for Economic Affairs and Climate Protection Robert Habeck said in a statement.

The European Union aims to produce 10 million t and import 10 million t of green hydrogen by 2030 in a bid to replace fossil fuels, which emit planet-warming gases when burned.

Green hydrogen is produced by splitting water through electrolysis using renewable energy. ■",poandpo.com,news,POST Online Media,,0.2392156862745098,454845023,1,https://www.histerius.com/hs0524/south2.jpg,eng-9613896
