uri,lang,isDuplicate,date,time,dateTime,dateTimePub,dataType,sim,url,title,body,source_uri,source_dataType,source_title,authors,sentiment,wgt,relevance,image,eventUri
8153694622,eng,False,2024-05-30,16:02:14,2024-05-30T16:02:14Z,2024-05-30T16:01:40Z,news,0.5843137502670288,https://www.argusmedia.com/en/news-and-insights/latest-market-news/2573196-enagas-lng-bunkering-sales-at-record-high-in-2023,Enagas LNG bunkering sales at record high in 2023 | Latest Market News,"You can unsubscribe from these updates at any time. We manage your personal data in accordance with our privacy policy.

Spanish system operator Enagas' supplies of LNG as a marine bunkering fuel from its terminals in Spain and LNG bunkering vessels (LNGBVs) rose to a record high last year, as more capacity and stronger demand boosted throughput.

Enagas supplied about 1.4TWh of LNG as a bunkering fuel in 2023, much more than the 400GWh supplied in 2022 and 300GWh in 2021, according to the firm.

Enagas has expanded its LNG bunkering capacity in recent years, while the cost of LNG as a marine fuel has held much lower than competing alternatives such as marine gas oil (MGO) over the past year, supporting demand for LNG bunkering operations.

The firm fully owns three LNG import terminals in Spain that offer LNG bunkering services -- the Barcelona, Huelva and the Cartagena facilities. Barcelona offers pipe-to-ship (PTS) and ship-to-ship (STS) services, Huelva offers STS services and will soon offer PTS services, while Cartagena offers PTS operations, while Enagas plans to add STS services at the port too, the firm said. Enagas subsidiary Scale Gas co-owns two LNGBVs -- the 5,000m³ Haugesund Knutsen in Barcelona with Norwegian firm Knutsen, and the 12,000m³ Levante LNG in Huelva, alongside UK supplier Peninsula.

Most of the LNG bunkering operations in Spain are carried out in Barcelona, where bunkering volumes similarly rose to an all-time high last year, according to the port authority. The increase to 143,000 m³ of LNG as a bunker fuel across 199 deliveries last year, more than double the previous record posted in 2021 of 65,051m³, was linked largely to the commissioning of the Haugesund Knutsen in 2023.

Enagas partially owns other assets that can offer truck-to-ship operations at the El Musel import terminal and the Sagunto and Bilbao LNG terminals. Bilbao can also provide PTS operations.

Spain aims to build on its presence in the LNG bunkering market, with several planned LNG bunkering projects adding to its already-large LNG import and storage capacity.

Utility Endesa recently advanced plans that were initially announced in 2021 to build a small LNG terminal with 5,000m³ of LNG storage capacity in the Spanish exclave of Melilla in north Africa. Endesa earlier this month requested permits for the project from the local government.

Endesa also has plans for an LNG bunkering project in the port of Algeciras, with an LNG plant comprising four tanks with a combined capacity of 4,000m³. The firm had intended to start offering services earlier this year, but this appears to have been delayed.

Scale Gas also aims to launch an LNGBV in the Canary Islands that it is building at present and aims to start operating in 2026. This LNGBV will also offer bio-LNG bunkering operations.",argusmedia.com,news,Argus Media,,0.07450980392156858,454780934,20,,eng-9606860
8152945469,eng,False,2024-05-30,07:58:46,2024-05-30T07:58:46Z,2024-05-30T07:57:33Z,news,0.0,https://www.marketscreener.com/quote/stock/ENAG-S-S-A-409361/news/Enag-s-S-A-Three-technology-projects-to-drive-the-energy-transition-win-the-Ingenia-Energy-Challe-46861545/,Enagás S A :  Three technology projects to drive the energy transition win the Ingenia Energy Challenge,"A total of 62 initiatives were submitted in this new edition, making Enagás as a benchmark in open corporate entrepreneurship to advance the energy transition.

The Archydra and CSIC-Structural evaluation of gas pipelines for H transport projects were two of the winners of the fifth edition of Ingenia - the second in the open format as the Ingenia Energy Challenge - in the categories of Internal Proposal, which promotes intraentrepreneurship at Enagás, and External Proposal, respectively. rn

The former, carried out by professionals at Enagás, applies the unlimited renewable energy of seawater to the processes of treating and managing renewable molecules, such as CO liquefaction and the production of green hydrogen and nitrogen, supported by regasification plants, achieving high efficiency and yields. rn

The latter, developed by the Spanish National Research Council (CSIC), focuses on the structural assessment of gas pipelines for hydrogen transport using CSIC-patented technology to verify the integrity of hydrogen pipelines and reused gas pipelines, enabling their certification for hydrogen transport. rn

In addition, Mayte Bolumar, with her AZIM project, was named the winner of the new Enterprising Woman category of this year's edition, which recognises women's contribution to advancing the energy transition. In this edition of the Ingenia Energy Challenge, 40% of the entries were from women, double the percentage of previous editions. rn

This project is based on the development of a comprehensive online training solution focused on the inspection and maintenance of renewable gas installations. rn

In his welcome speech at the Ingenia Energy Challenge final event, the CEO of Enagás, Arturo Gonzalo, stressed that ""innovation is not only important"" but also ""urgent"", taking into account that this type of ""innovation not only responds to an objective of growth, but also to social progress"". The CEO also explained that through this initiative, ""we seek innovation to advance the energy transition with a purpose that transcends business and economic objectives"". rn

Arturo Gonzalo presented the award for the best Internal Proposal; the Chief Innovation & Technology Officer of Redeia, Silvia Bruno, presented the award for the best External Proposal; and the General Director of Communication, Institutional and Investor Relations of Enagás, Felisa Martín, presented the award for the best Enterprising Woman. rn

In addition to the three winning projects, four other projects - out of a total of 62 projects submitted - were acknowledged by the judges for having reached the final of the Ingenia Energy Challenge, all providing disruptive solutions that contribute to decarbonisation: rn

EnaMOF is a proposal from the Leitat Technology Centre, sponsored by the government of Catalonia, together with the Industrial Technology Centre of Castilla-La Mancha (ITECAM), the applied research technology centre of the University of Valladolid (CARTIF) and the Technological Institute for Packaging, Transport and Logistics of Valencia (ITENE), for the development of metal-organic frameworks (MOFs) for the prevention and monitoring of methane and hydrogen emissions in gas distribution and transmission systems. rn

Silex, an initiative by the Canary Islands start-up APSU, is developing a reactor that uses a special technology to capture CO in combustion engines, regenerating the elements that hold it (amines and zeolites) to prevent saturation and allow for greater efficiency and carbon footprint reduction. rn

Netzero IIOT is an initiative by the Catalan start-up Aeinnova that uses the Internet of Things (IoT) to develop maintenance-free and lithium battery-free autonomous industrial sensors that operate with longrange wireless and are powered by residual heat or wind. rn

Finally, H2Mell is a project for the selection of odorant and bio-odorants for hydrogen, with the aim of defining an international standard with a proposal that bears the Enagás brand and seal. rn

The fifth edition of the Ingenia Energy Challenge, organised by Enagás Emprende, Enagás' Corporate Entrepreneurship and Open Innovation Programme, was launched on 26 September 2023, within the framework of the Enagás Innovation Day event, with the aim of promoting ideas and projects in three main areas: renewable gases (with priority given to green hydrogen) and new transport fuels; sustainability and energy efficiency; and industry 4.0 and digitalisation. rn

All these areas covered by the competition are aligned with the different challenges and needs of the company, and both new business proposals - at any stage of development - and technical solutions to the challenges posed have been submitted. rn

The panel of expert judges is made up of members of the Enagás Executive Committee. Along with Arturo Gonzalo, the members are the Secretary General, Diego Trillo; the Business Development and Affiliates General Manager, Jesús Saldaña; the Director General of Energy Transition, Natalia Latorre; the Enagás Gas Assets General Manager, Claudio Rodríguez; the People and Transformation General Manager, Javier Perera; the Chief Financial Officer, Luis Romero; the General Manager of Engineering, Technology and Digitalisation, Susana de Pablo; Technical Management of the System General Manager, María Junco; and the Public Affairs & Investor Relations General Manager, Felisa Martín. rn

There are also three external judges. In addition to Silvia Bruno, the CEO of Axis (corporate venture capital vehicle of ICO), Guillermo Jiménez; and the Partner and CEO of Private Capital, Energy Transition and Technology at Alantra, Patricia Pascual. rn

At the closing ceremony, Jesús Saldaña expressed his opinion that in this edition of the Ingenia Energy Challenge, ""innovation is more open and collaborative than ever"", and stressed that ""both internal and external talent is necessary to achieve our goals of decarbonisation and security of supply"", creating ""an ecosystem where technology centres, corporations, entrepreneurs and intraentrepreneurs work together"". rn

More information on the web de Ingenia Energy Challenge. rn""}}"" id=""text-7939fc2d21"" class=""cmp-text"">

The Archydra and CSIC-Structural evaluation of gas pipelines for H transport projects were two of the winners of the fifth edition of Ingenia - the second in the open format as the Ingenia Energy Challenge - in the categories of Internal Proposal, which promotes intraentrepreneurship at Enagás, and External Proposal, respectively.

The former, carried out by professionals at Enagás, applies the unlimited renewable energy of seawater to the processes of treating and managing renewable molecules, such as CO liquefaction and the production of green hydrogen and nitrogen, supported by regasification plants, achieving high efficiency and yields.

The latter, developed by the Spanish National Research Council (CSIC), focuses on the structural assessment of gas pipelines for hydrogen transport using CSIC-patented technology to verify the integrity of hydrogen pipelines and reused gas pipelines, enabling their certification for hydrogen transport.

In addition, Mayte Bolumar, with her AZIM project, was named the winner of the new Enterprising Woman category of this year's edition, which recognises women's contribution to advancing the energy transition. In this edition of the Ingenia Energy Challenge, 40% of the entries were from women, double the percentage of previous editions.

This project is based on the development of a comprehensive online training solution focused on the inspection and maintenance of renewable gas installations.

In his welcome speech at the Ingenia Energy Challenge final event, the CEO of Enagás, Arturo Gonzalo, stressed that ""innovation is not only important"" but also ""urgent"", taking into account that this type of ""innovation not only responds to an objective of growth, but also to social progress"". The CEO also explained that through this initiative, ""we seek innovation to advance the energy transition with a purpose that transcends business and economic objectives"".

Arturo Gonzalo presented the award for the best Internal Proposal; the Chief Innovation & Technology Officer of Redeia, Silvia Bruno, presented the award for the best External Proposal; and the General Director of Communication, Institutional and Investor Relations of Enagás, Felisa Martín, presented the award for the best Enterprising Woman.

In addition to the three winning projects, four other projects - out of a total of 62 projects submitted - were acknowledged by the judges for having reached the final of the Ingenia Energy Challenge, all providing disruptive solutions that contribute to decarbonisation:

EnaMOF is a proposal from the Leitat Technology Centre, sponsored by the government of Catalonia, together with the Industrial Technology Centre of Castilla-La Mancha (ITECAM), the applied research technology centre of the University of Valladolid (CARTIF) and the Technological Institute for Packaging, Transport and Logistics of Valencia (ITENE), for the development of metal-organic frameworks (MOFs) for the prevention and monitoring of methane and hydrogen emissions in gas distribution and transmission systems.

Silex, an initiative by the Canary Islands start-up APSU, is developing a reactor that uses a special technology to capture CO in combustion engines, regenerating the elements that hold it (amines and zeolites) to prevent saturation and allow for greater efficiency and carbon footprint reduction.

Netzero IIOT is an initiative by the Catalan start-up Aeinnova that uses the Internet of Things (IoT) to develop maintenance-free and lithium battery-free autonomous industrial sensors that operate with longrange wireless and are powered by residual heat or wind.

Finally, H2Mell is a project for the selection of odorant and bio-odorants for hydrogen, with the aim of defining an international standard with a proposal that bears the Enagás brand and seal.

The fifth edition of the Ingenia Energy Challenge, organised by Enagás Emprende, Enagás' Corporate Entrepreneurship and Open Innovation Programme, was launched on 26 September 2023, within the framework of the Enagás Innovation Day event, with the aim of promoting ideas and projects in three main areas: renewable gases (with priority given to green hydrogen) and new transport fuels; sustainability and energy efficiency; and industry 4.0 and digitalisation.

All these areas covered by the competition are aligned with the different challenges and needs of the company, and both new business proposals - at any stage of development - and technical solutions to the challenges posed have been submitted.

The panel of expert judges is made up of members of the Enagás Executive Committee. Along with Arturo Gonzalo, the members are the Secretary General, Diego Trillo; the Business Development and Affiliates General Manager, Jesús Saldaña; the Director General of Energy Transition, Natalia Latorre; the Enagás Gas Assets General Manager, Claudio Rodríguez; the People and Transformation General Manager, Javier Perera; the Chief Financial Officer, Luis Romero; the General Manager of Engineering, Technology and Digitalisation, Susana de Pablo; Technical Management of the System General Manager, María Junco; and the Public Affairs & Investor Relations General Manager, Felisa Martín.

There are also three external judges. In addition to Silvia Bruno, the CEO of Axis (corporate venture capital vehicle of ICO), Guillermo Jiménez; and the Partner and CEO of Private Capital, Energy Transition and Technology at Alantra, Patricia Pascual.

At the closing ceremony, Jesús Saldaña expressed his opinion that in this edition of the Ingenia Energy Challenge, ""innovation is more open and collaborative than ever"", and stressed that ""both internal and external talent is necessary to achieve our goals of decarbonisation and security of supply"", creating ""an ecosystem where technology centres, corporations, entrepreneurs and intraentrepreneurs work together"".",marketscreener.com,news,Market Screener,,0.4901960784313726,454751926,77,,
8151330789,eng,False,2024-05-29,09:43:43,2024-05-29T09:43:43Z,2024-05-29T09:42:50Z,news,0.5098039507865906,https://www.chemanalyst.com/NewsAndDeals/NewsDetails/enagas-pioneers-maritime-decarbonization-quadruples-lng-supply-in-two-years-28082,"Enagás Pioneers Maritime Decarbonization, Quadruples LNG Supply in Two Years","Enagás has solidified its standing as a premier European operator in the decarbonization of maritime transport via the provision of liquefied natural gas (LNG bunkering). The quantity of LNG supplied as fuel by Enagás-managed facilities in 2023 reached 1,359 GWh, marking a more than fourfold increase compared to 2021 (300 GWh).

The increased utilization of LNG has enabled the prevention of over 74,000 tonnes of CO2 equivalent emissions, as well as virtually eliminating emissions of sulfur and nitrogen oxides (SOx and NOx), thereby enhancing air quality within port surroundings.

Enagás has enacted holistic measures by modifying its terminals and constructing supply barges through its subsidiary Scale Gas, establishing itself as the European operator boasting the highest combined loading capacity.

This advancement stems from the efficacy of public-private partnerships seen in projects like CORE LNGas hive and LNGhive2, jointly funded by the European Commission. Spearheaded by Puertos del Estado and overseen by Enagás, these endeavors have established an integrated, secure, and effective logistics framework for LNG fuel supply across the Iberian Peninsula.

The regasification terminal operated by Enagás in Barcelona is capable of facilitating direct bunkering operations (pipe to ship, PTS). Since the commencement of operations by the Haugesund Knutsen, a vessel jointly owned by Knutsen and Scale Gas, in Barcelona in early 2023, the terminal has also facilitated LNG fuel supply through small vessels (ship to ship, STS). Through bunkering operations at the Port of Barcelona, emissions equivalent to 63,000 tonnes of CO2 have already been prevented.

Following the initiation of operations of the Levante LNG vessel, jointly owned by Peninsula and Scale Gas, the volume loaded at the Enagás plant in Huelva during the first four months of 2024 surged by 82% compared to the total supply in 2023. This terminal facilitates LNG loading onto STS supply barges and is slated to soon commence PTS operations. Furthermore, Scale Gas is constructing a third LNG and BioLNG supply vessel, backed by the Spanish Government's support through Next Generation funds, which is set to primarily operate in the Canary Islands starting from 2026.

The Enagás terminal in Cartagena, a frontrunner in Europe for providing PTS services, will soon expand its offerings to include STS operations.

Apart from the three regasification terminals wholly owned by Enagás, the company's majority-owned terminals in Spain also offer bunkering services: El Musel in Gijón, Saggas in Sagunto, and BBG in Bilbao provide Truck to Ship (TTS) services, with BBG additionally offering PTS services.",chemanalyst.com,news,chemanalyst.com,,0.3411764705882352,454671823,28,,eng-9600991
8150983848,eng,False,2024-05-29,05:56:18,2024-05-29T05:56:18Z,2024-05-29T05:55:53Z,news,0.5568627715110779,https://en.trend.az/business/energy/3905353.html,Enagas enhances role in European maritime decarbonization with record LNG bunkering,"BAKU, Azerbaijan, May 29. Spanish Enagas company has solidified its standing as a premier European operator in the decarbonization of maritime transport through the supply of liquefied natural gas (LNG) for bunkering, Trend reports via the company.

In 2023, Enagas-operated plants achieved a remarkable milestone, loading 1,359 GWh of LNG as fuel, a more than fourfold increase from the 300 GWh recorded in 2021.

This surge in LNG usage has significantly reduced emissions, preventing over 74,000 tonnes of CO2 equivalent and nearly eliminating sulphur and nitrogen oxides (SOx and NOx) emissions, thus enhancing air quality in port areas.

The success stems from public-private partnerships like CORE LNGas hive and LNGhive2, co-funded by the European Commission. These initiatives, spearheaded by Puertos del Estado and coordinated by Enagas, have established a comprehensive and efficient logistics chain for LNG fuel supply on the Iberian Peninsula.

The Enagas regasification terminal in Barcelona now supports direct bunkering operations (pipe to ship, PTS) and, since early 2023, has facilitated ship-to-ship (STS) LNG fuel supply through the Haugesund Knutsen vessel, co-owned by Knutsen and Scale Gas. These efforts in the Port of Barcelona alone have prevented 63,000 tonnes of CO2 equivalent emissions.

Further advancements were seen with the Levante LNG vessel, co-owned by Peninsula and Scale Gas. In the first four months of 2024, LNG volumes loaded at the Enagas plant in Huelva soared by 82 percent compared to total 2023 supply. This terminal now loads LNG onto STS supply barges and will soon commence PTS operations. Additionally, Scale Gas, supported by Spanish Government's Next Generation funds, is constructing a third LNG and BioLNG supply vessel set to operate primarily in the Canary Islands from 2026.

The Cartagena terminal, a pioneer in Europe for offering PTS services, will soon extend its capabilities to include STS operations. Enagas's wholly owned terminals, along with majority-owned terminals in El Musel (Gijon), Saggas (Sagunto), and BBG (Bilbao), also provide essential Truck to Ship (TTS) services, with BBG additionally offering PTS.

Follow the author on X: @Lyaman_Zeyn",en.trend.az,news,International News Agency Trend,,0.2549019607843137,454658178,20,https://en.trend.az/imagen/3905353,eng-9600991
2024-05-359625891,eng,False,2024-05-17,16:40:55,2024-05-17T16:40:55Z,2024-05-17T16:40:10Z,news,0.0,https://www.cliffordchance.com/content/cliffordchance/news/news/2024/03/clifford-chance-advises-hanseatic-energy-hub-gmbh-on-financing-t.html,"Clifford Chance | Clifford Chance advises Hanseatic Energy Hub GmbH on financing the development, construction and operation of Germany's first land-based terminal for liquefied gases","Clifford Chance advises Hanseatic Energy Hub GmbH on financing the development, construction and operation of Germany's first land-based terminal for liquefied gases

Global law firm Clifford Chance has advised Hanseatic Energy Hub GmbH in relation to the financing of the development, construction and operation of Germany's first land-based terminal for liquefied gases. The total investment volume amounts to approx. €1.6 billion. By reaching financial close, Hanseatic Energy Hub GmbH has achieved a major milestone. The terminal in Stade near Hamburg in Lower Saxony is the first project-financed land-based LNG terminal in Germany. The shareholders of Hanseatic Energy Hub GmbH include Partners Group, Enagás, Dow and the Buss Group.

The official ground-breaking ceremony for the energy hub in the Stade industrial park is scheduled to be held in the coming weeks. The facility is set to receive its first cargo in 2027. In a first expansion phase, an emission-free LNG terminal is to be put into operation, the infrastructure of which is also authorised for bio-LNG and synthetic natural gas (SNG). This will later be followed by ammonia as a carbon-neutral, hydrogen-based energy carrier.

With a total capacity of 13.3 billion cubic metres of LNG per year, the Hanseatic Energy Hub will play an important role in securing the energy supply and supporting the energy transition in both Germany and wider Europe. In addition, the FSRU ""Energos Force"", one of five floating LNG terminals chartered by Germany's federal government and on site since March 2024, will continue to secure the gas supply in the short term until the more efficient land-based terminal is completed.

Florian Mahler, partner at Clifford Chance: ""This is another landmark transaction in the energy and energy transition sector in Germany and globally, showing our strong capabilities and integrated team approach. Securing the first project financing of a land-based LNG terminal in Germany is a huge achievement for all parties involved.""

With this mandate, Clifford Chance is emphasising its strategic focus on the energy sector and advising on the energy transition. Its global energy and infrastructure practice group is being continuously expanded, most recently with the opening of an office specialising in the energy transition sector in Houston, USA for which many new partners have been recruited.

Clifford Chance advised with an international team led by partner Florian Mahler. The team comprised counsels Georg Lübbehüsen (Frankfurt) and Nicolas Cookson, associates Marius Fritz, Iryna Karpliuk and Brianna Harcus, transaction lawyer Muhammad Vantra (all Düsseldorf) and trainee solicitor Tim Bitterlich (London, all Global Financial Markets), partner Mathias Elspaß, counsel Zaid Mansour and associate Marie Sofie Karle (all Energy, Düsseldorf). Hedging advice was provided by partner Anne Louise Drakeford (London), counsels David Neu (Munich) and Radoslav Lolov (Frankfurt) as well as associate Christopher Banks (Munich, all Global Financial Markets). The Luxembourg office advised with partner Martin Wurth, senior associate Donald Sefer, associate Tjasa Perger and trainee lawyer Victor Hilbertz (all Global Financial Markets). From Madrid, partner Iñigo Villoria (Litigation & Dispute Resolution), partner Eugenio Fernández-Rico and associates Álvaro Cabaleiro and María González (all Global Financial Markets) provided support. Further team members were partner Daniel Mathew Winick and associate Ronald Britt, II (both New York).",cliffordchance.com,news,Clifford Chance,,0.2078431372549019,453660055,1,https://www.cliffordchance.com/content/dam/cliffordchance/icons/ccogimage.png,
