uri,lang,isDuplicate,date,time,dateTime,dateTimePub,dataType,sim,url,title,body,source_uri,source_dataType,source_title,authors,sentiment,wgt,relevance,image,eventUri
2024-05-356424260,eng,False,2024-05-15,07:52:52,2024-05-15T07:52:52Z,2024-05-15T07:52:37Z,news,0.4666666686534882,https://www.argusmedia.com/pages/NewsBody.aspx?id=2567144&menu=yes,"Spanish ceramics sector worried about H2 supply, cost","London, 10 May (Argus) -- Supply limitations and high prices of renewable hydrogen will pose a challenge to the Spanish ceramics sector's decarbonisation goals, according to an industry association.

Companies in the sector are mulling the use of renewable hydrogen in their operations, ""but it is a real challenge because of the volume that we need and the cost"", the general secretary of Spain's association of ceramic tile and flooring manufacturers (ASCER), Alberto Echavarria, told Argus.

The industry currently consumes around 15TWh/yr of natural gas, accounting for nearly 10pc of Spain's industrial gas demand. This would equate to around 380,000 t/yr of hydrogen, based on the higher heating value of 39.39kWh/kg. And it would not be far off the 500,000 t/yr of conventional hydrogen made from natural gas with unabated emissions that Spanish industry as a whole consumes currently.

Making 380,000 t/yr could require some 4GW of electrolyser capacity for the ceramics industry alone, equivalent to over one-third of Spain's 2030 target of 11GW.

In any event, existing technology can support no more than 10pc hydrogen blending in the kilns, Echavarria said. ASCER is in talks with kiln manufacturers developing hydrogen-ready ovens, but these are in a testing phase and are not expected to be available at industrial scale in the near future.

Alternatives for decarbonisation are thin on the ground. Electrifying operations is not a viable option, Echavarria said. While some parts of the ceramic production process can run on electricity, the industry ovens, known as kilns, fire at temperatures reaching 1,200°C, which are much too high for electricity. And the kilns represent 50-60pc of the sector's energy consumption, according to Echavarria.

Another alternative would be to use biomethane or e-methane, at least until hydrogen-fired kilns reach industrial scale. This approach would require minor modifications in facilities and would allow them to continue using the current infrastructure and distribution system. But biomethane is also only available in small volumes, and making e-methane requires electrolytic hydrogen, raising the same issues over supply availability and costs as direct hydrogen use.

Net emissions could also be reduced by implementing carbon capture technology but this would be even less cost-competitive, Echavarria said. It would require mechanisms to concentrate CO2 molecules at a focal point, which is an expensive undertaking, he said.

Piping hot

Future hydrogen use for ceramics production would depend on connections to a hydrogen pipeline system.

Spain's ceramics industry, which is the largest in Europe, is mainly concentrated in Castellon, where more than 150 facilities are based.

It is not practical to ""have 150 electrolysers"" and produce locally, Echavarria said, not least because the plants would need round-the-clock hydrogen supply to maintain the high temperatures.

ASCER has been collaborating with Spanish gas system operator Enagas on plans for the development of the Spanish hydrogen backbone to ensure access for its companies, he said. Firms have also looked into sourcing hydrogen via trucks, according to Echavarria. But this would require storage facilities, raising costs and safety concerns.",argusmedia.com,news,Argus Media,,0.08235294117647052,453455572,1,,eng-9561767
8123045807,eng,False,2024-05-12,02:21:20,2024-05-12T02:21:20Z,2024-05-12T02:20:44Z,news,0.0,https://tass.com/economy/1786561,Russia remaining second largest supplier of LNG to Spain,"In the first four months of 2024, Madrid purchased 26,854 GWh of gas from Russia, according to data provided by Spanish energy company Enagas

MADRID, May 12. /TASS/. Russia ranked second in liquefied natural gas (LNG) supplies to Spain in April 2024, according to data provided by Spanish energy company Enagas.

According to the report, Spain bought the equivalent of 5,342 GWh of LNG from Russia this April. As a result, Russia took the second position in terms of this fuel supply volumes to the country, behind only Algeria. In the first four months of 2024, Madrid purchased 26,854 GWh of gas from Russia.

Enagas earlier reported that Spain acquired 72,690 GWh of Russian LNG in 2023, up from 53,859 GWh in 2022. Thus, based on last year's data, Russia became the kingdom's third largest gas provider.

Russian Ambassador in Madrid Yury Klimenko told TASS earlier, Spain has become the main buyer of Russian LNG in the European Union in 2022-2023. According to the diplomat, from an economic point of view, it would not profitable for the kingdom to break the large long-term contract signed with Russia. In addition, Klimenko drew attention to the fact that, using existing storage and regasification capacities, Spain is actively re-exporting a portion of its gas to other European countries.",tass.com,news,TASS,,0.05098039215686279,453176480,9,https://cdn-media.tass.ru/width/1200_4ce85301/tass/m2/en/uploads/i/20240512/1418781.jpg,
8121735014,eng,False,2024-05-11,02:28:28,2024-05-11T02:28:28Z,2024-05-11T02:27:02Z,news,0.0,https://whatech.com/og/markets-research/mining/823114-gulf-of-mexico-oil-and-gas-mid-stream-market-future-prospects-trends-growth-key-player-swot-analysis-by-2030,"Gulf of Mexico Oil and Gas Mid-Stream Market Future Prospects, Trends, Growth, Key Player SWOT Analysis by 2030","The Gulf of Mexico Oil and gas Mid-Stream Market is expected to grow at a high CAGR during the forecasting period. This market research report examines key players such as: Chevron Corporation, DCP Midstream, LLC, PSI Midstream Partners

The report named, ""Gulf of Mexico Oil and Gas Mid-Stream Market Research Report 2023"" has been added to the archive of market research studies by DataM Intelligence. The industry experts and researchers have offered reliable and precise analysis of the Gulf of Mexico Oil and Gas Mid-Stream market in view of numerous aspects such as growth factors, challenges, limitations, developments, trends, and growth opportunities.

This report will surely act as a handy instrument for the market participants to develop effective strategies with an aim to reinforce their market positions. This report offers pin-point analysis of the changing dynamics and emerging trends in the Gulf of Mexico Oil and Gas Mid-Stream market.

Additionally, it provides a futuristic perspective on various factors that are likely to boost the Gulf of Mexico Oil and Gas Mid-Stream market growth in the years to come. Besides, authors of the report have shed light on the factors that may hamper the growth of the Gulf of Mexico Oil and Gas Mid-Stream market.

Get PDF Sample Copy of Report: (Including Full TOC, List of Tables & Figures, Chart): datamintelligence.com/downloa...eam-market

Market Definition:

The Gulf of Mexico oil and gas midstream market involves the infrastructure and services related to the transportation, storage, and processing of oil and gas resources extracted from offshore fields in the Gulf region. This includes pipelines, terminals, offshore platforms, and facilities for liquefied natural gas (LNG) processing.

Market growth is driven by ongoing exploration and production activities, increasing demand for energy resources, and investments in expanding midstream infrastructure to support offshore operations in the Gulf of Mexico. Additionally, regulatory developments and technological advancements influence market dynamics in this sector.

Market Growth:

A significant growth driver for the Gulf of Mexico oil and gas midstream market is the continuous exploration and development of offshore oil and gas reserves in the region. As production activities increase, there is a growing need for efficient transportation and storage infrastructure to handle the extracted resources.

Additionally, advancements in offshore drilling technology and extraction techniques contribute to the discovery of new reserves, further fueling midstream market growth. Moreover, strategic investments by companies in expanding midstream infrastructure, such as pipelines and terminals, to support the growing offshore production in the Gulf of Mexico, drive market expansion.

Who is the largest manufacturers of Gulf of Mexico Oil and Gas Mid-Stream Market worldwide?

Chevron Corporation, DCP Midstream, LLC, PSI Midstream Partners, LP, Enagas SA, Crimson Midstream, LLC, Energy Midstream Companies Inc., Riverstone Holdings LLC, RBN Energy, LLC, Williams Companies Inc. and Royal Vopak NV.

To Know More Insights - datamintelligence.com/researc...eam-market

SEGMENT Analysis:

By Type: Transportation, LNG Terminal.

Objectives of the Report

-To carefully analyze and forecast the size of the Gulf of Mexico Oil and Gas Mid-Stream market by value and volume.

-To estimate the market shares of major segments of the Gulf of Mexico Oil and Gas Mid-Stream market.

-To showcase the development of the Gulf of Mexico Oil and Gas Mid-Stream market in different parts of the world.

-To analyze and study micro-markets in terms of their contributions to the Gulf of Mexico Oil and Gas Mid-Stream market, their prospects, and individual growth trends.

-To offer precise and useful details about factors affecting the growth of the Gulf of Mexico Oil and Gas Mid-Stream market.

-To provide a meticulous assessment of crucial business strategies used by leading companies operating in the Gulf of Mexico Oil and Gas Mid-Stream market, which include research and development, collaborations, agreements, partnerships, acquisitions, mergers, new developments, and product launches.

Key questions answered

How feasible is Gulf of Mexico Oil and Gas Mid-Stream market for long-term investment?

What are influencing factors driving the demand for Gulf of Mexico Oil and Gas Mid-Stream near future?

What is the impact analysis of various factors in the Gulf of Mexico Oil and Gas Mid-Stream market growth?

What are the recent trends in the regional market and how successful they are?

Get Customization in the report as per your requierments: datamintelligence.com/customi...eam-market

Table of Content:

Gulf of Mexico Oil and Gas Mid-Stream Market - Methodology and Scope Research Methodology Research Objective and Scope of the Report Gulf of Mexico Oil and Gas Mid-Stream Market - Market Definition and Overview Gulf of Mexico Oil and Gas Mid-Stream Market - Executive Summary Market Snippet by Type Gulf of Mexico Oil and Gas Mid-Stream Market-Market Dynamics Market Impacting Factors Drivers The growth in the pipeline sector drives the oil and gas mid-stream market XX Restraints Cyclone threats are likely to cause delays for the projects in the Gulf of Mexico oil and gas mid-stream XX Opportunity XX Impact Analysis Gulf of Mexico Oil and Gas Mid-Stream Market - Industry Analysis Porter's Five Forces Analysis Supply Chain Analysis Pricing Analysis Regulatory Analysis Gulf of Mexico Oil and Gas Mid-Stream Market - COVID-19 Analysis Analysis of COVID-19 on the Market Before COVID-19 Market Scenario Present COVID-19 Market Scenario After COVID-19 or Future Scenario Pricing Dynamics Amid COVID-19 Demand-Supply Spectrum Government Initiatives Related to the Market During Pandemic Manufacturers Strategic Initiatives Conclusion News From DataM Intelligence

Category: Industry Reports & Market Analysis Profile: DataM Intelligence ensures that your business decisions are remarkable with our extensive research and profound knowledge of the market research industry. This email address is being protected from spambots. You need JavaScript enabled to view it.

For more information:

www.datamintelligence.com/researc...eam-market datamintelligence.com/researc...eam-market datamintelligence.com/downloa...eam-market datamintelligence.com/customi...eam-market www.datamintelligence.com",whatech.com,news,WhaTech,Ch. Sravya Teja,0.411764705882353,453090508,1,,
2024-05-351280903,eng,False,2024-05-10,10:42:25,2024-05-10T10:42:25Z,2024-05-10T10:39:51Z,news,0.800000011920929,https://www.gminsights.com/industry-analysis/hydrogen-pipeline-market,"Hydrogen Pipeline Market Size 2024-2035, Global Report","Hydrogen Pipeline Market was valued at more than USD 2.96 billion in 2023 and is anticipated to grow at a CAGR of over 60.3% from 2024 to 2035. A hydrogen pipeline is a combination of pipes and associated infrastructure designed to transport gas from the production facility to various end users or storage facilities. The pipelines are a critical component of the hydrogen supply chain, enabling the distribution of hydrogen for various industrial, commercial, and transportation applications. Reuse of the existing carbon steel natural gas transmission and other pipelines for hydrogen service will influence the business statistics.

Growing focus on hydrogen as a clean energy carrier along with the development of hydrogen infrastructure to support its production, transportation, and utilization is set to influence the industry trends. Increasing focus on decarbonization coupled with transition to clean energy has positioned hydrogen as a crucial element in achieving the sustainability goals. Further, rising use of hydrogen as a clean energy carrier by the governments, industries, and investors along with the potential to reduce carbon emissions across various sectors will drive the business scenario.

Introduction of government policies along with providing financial support to promote the development and use of hydrogen is set to drive the business scenario. Incentives, subsidies, and funding for hydrogen infrastructure projects, including pipelines, will support the market statistics. Ongoing national hydrogen strategies and commitments will influence the growth of hydrogen-related infrastructure, thereby impacting the product demand.

Hydrogen Pipeline Market Trends

Repurposing and integration of the existing natural gas pipelines for hydrogen transportation, will support leverage the existing infrastructure, contributing to the market statistics. Additionally, industries including refining, chemicals, and manufacturing, are continuously exploring hydrogen as a cleaner alternative for their processes, driving the need for efficient and reliable hydrogen transportation infrastructure, including pipelines.

Hydrogen Pipeline Market Analysis

Based on classification, the repurposed hydrogen pipeline segment will exceed more than USD 650 million by 2035. The pipelines involve converting existing natural gas pipelines for the transportation of hydrogen. They enable this blending process, allowing for a smooth transition toward higher hydrogen content in the gas grid, thereby supporting the development of hydrogen infrastructure. These are more cost effective than building new infrastructure. Blending allows for the gradual introduction of hydrogen into existing natural gas infrastructure, supporting the transition to a hydrogen economy, thereby stimulating the business statistics.

Based on type, the onshore hydrogen pipeline will showcase gains at nearly 59.5% up to 2035. The onshore pipelines are designed to transport hydrogen gas from production sites, comprising of electrolysis plants or steam methane reforming facilities, to various points of consumption. These play a crucial role in the transportation of hydrogen from production facilities to end users, including industrial consumers, power plants, and refueling stations for fuel cell vehicles. Further, these are designed to facilitate the blending of hydrogen with other gases, including natural gas.

Ongoing integrated with other elements, including production facilities, storage systems, and distribution networks, to create a seamless and efficient hydrogen delivery system will drive the product demand. The length and connectivity of the onshore hydrogen pipelines depend on the geographical distribution of hydrogen demand centers and production sites. The long distance pipelines further connect regions with surplus hydrogen production to areas with high demand. They need to comply with local, regional, and national regulations governing the transportation of hazardous materials, thereby augmenting the business landscape.

Europe hydrogen pipeline market is projected to witness about 105.5% CAGR through 2035. The European Union (EU) and individual European countries have been actively pursuing strategies to integrate hydrogen into their energy systems as part of broader decarbonization efforts. Ongoing development of national hydrogen strategies across the economies that primarily outline targets, policies, and investments to promote the use of hydrogen, including the plans for building and expanding the hydrogen pipeline networks, will sway the market trends. Furthermore, collaborative efforts between the countries will drive the development of cross border hydrogen pipelines, which will augment the industry dynamics.

Hydrogen Pipeline Market Share

DESFA, Energinet, Fluxys, Gasunie, GAZ-SYSTEM and Enagas are some prominent players operating in the industry. Several companies with expertise in pipeline construction, materials, and infrastructure are involved in the development and deployment of hydrogen pipelines. It includes transmission service operators responsible for building and managing pipeline networks, as well as manufacturers specializing in the fabrication and technology associated with hydrogen pipelines. Further, the companies leverage their expertise in pipeline design, construction, and operation to support hydrogen infrastructure development.

Hydrogen Pipeline Market Companies

Eminent players operating in the hydrogen pipeline industry are:

This hydrogen pipeline market research report includes in-depth coverage of the industry with estimates & forecast in terms of 'Km & USD Million' from 2024 to 2032 for the following segments:

The above information will be provided for the following regions:",gminsights.com,news,"Global Market Insights, Inc.","Ankit Gupta, Srishti Agarwal",0.2705882352941176,453033745,1,https://www.gminsights.com/assets_v2/images/gmi-logo-gradient-full-name-mostsharp.png,eng-9549982
8117437274,eng,True,2024-05-08,13:11:44,2024-05-08T13:11:44Z,2024-05-08T13:11:25Z,news,0.0,https://www.naturalgasworld.com/naturgy-says-gas-supply-deals-with-algeria-unaffected-by-any-shareholding-change-111087,Naturgy says gas supply contracts with Algeria unaffected by any shareholding change,"MADRID, May 7 (Reuters) - Spanish energy firm Naturgy said on Tuesday that its gas supply contracts with Algeria do not include any clauses that would be affected by changes to its shareholding structure.

The comments come after a source told Reuters that Algeria would cancel deliveries of gas to Naturgy if the Spanish firm's shares are sold to another company.

The source did not name the firm that could buy Naturgy's shares, but Abu Dhabi's TAQA said last month it was in discussions with Naturgy's three largest shareholders which could lead to a full takeover bid for the largest natural gas firm in Spain.

""There have never been any clauses in the supply contracts (the current contracts expire in 2030/31) that were affected by possible changes in the shareholding of either party,"" a spokesperson told Reuters.

""In fact, such shareholder changes have occurred in the past and have had no impact on the contracts' performance,"" he added.

Algeria's ties with the United Arab Emirates, of which Abu Dhabi is the capital, have suffered in recent years after the UAE and Morocco were among Arab states boosting ties with Israel in the so-called Abraham Accords. Algeria and Morocco are major regional rivals, while Algeria champions the Palestinian cause and was critical of the accords.

Spokespeople for Spain's energy, economy and foreign ministries declined to comment on the possibility of Algerian gas supplies being cut. Representatives for Algeria's government were not immediately available to comment. TAQA said it ""does not comment on market rumour or speculation"" while the UAE government did not reply to a request for comment.

Naturgy has gas contracts with Algerian state oil and gas company Sonatrach for about 5 billion cubic metres (bcm) per year, according to figures the Spanish company gave to the market in 2022. The parties are negotiating prices for 2023, retroactively, and 2024.

Algerian gas made up roughly one-third of Spain's total gas imports in the first three months of the year, according to data from Spanish gas grid operator Enagas.

The bulk of the supply comes via the Medgaz pipeline, in which Naturgy is a minority partner and Sonatrach holds a 51% stake. Sonatrach also has a stake of about 4% in Naturgy.

Naturgy hailed its more than 50-year-old relationship with Sonatrach.

""During all these years, there have been no breaches by either party. Not even in politically sensitive times on both sides of the Mediterranean have the contracts not been honoured,"" it said.

TAQA said last month it was in talks with private equity firms CVC and GIP about buying each of their 20% plus stakes in Naturgy, and also with Naturgy's largest shareholder Criteria, which owns a 26.7% stake, about a possible partnership.

Criteria declined to comment on the future of Algerian gas deliveries.

(Reporting by Pietro Lombardi, Lamine Chikhi, additional reporting by Belen Carreño, Jesus Aguado, Maha El Dahanm, Federico Maccioni; Editing by David Latona, Kirsten Donovan)",naturalgasworld.com,news,Natural Gas World,,0.09019607843137245,452869904,1,https://www.naturalgasworld.com/content/111087/Pipeline100_f175x175.jpg,
8115793567,eng,False,2024-05-07,15:01:22,2024-05-07T15:01:22Z,2024-05-07T14:59:29Z,news,0.0,https://www.dailymail.co.uk/wires/reuters/article-13391899/Naturgy-says-gas-supply-contracts-Algeria-unaffected-shareholding-change.html,Naturgy says gas supply contracts with Algeria unaffected by any...,"MADRID, May 7 (Reuters) - Spanish energy firm Naturgy said on Tuesday that its gas supply contracts with Algeria do not include any clauses that would be affected by changes to its shareholding structure.

The comments come after a source told Reuters that Algeria would cancel deliveries of gas to Naturgy if the Spanish firm's shares are sold to another company.

The source did not name the firm that could buy Naturgy's shares, but Abu Dhabi's TAQA said last month it was in discussions with Naturgy's three largest shareholders which could lead to a full takeover bid for the largest natural gas firm in Spain.

""There have never been any clauses in the supply contracts (the current contracts expire in 2030/31) that were affected by possible changes in the shareholding of either party,"" a spokesperson told Reuters.

""In fact, such shareholder changes have occurred in the past and have had no impact on the contracts' performance,"" he added.

Algeria's ties with the United Arab Emirates, of which Abu Dhabi is the capital, have suffered in recent years after the UAE and Morocco were among Arab states boosting ties with Israel in the so-called Abraham Accords. Algeria and Morocco are major regional rivals, while Algeria champions the Palestinian cause and was critical of the accords.

Spokespeople for Spain's energy, economy and foreign ministries declined to comment on the possibility of Algerian gas supplies being cut. Representatives for Algeria's government were not immediately available to comment. TAQA said it ""does not comment on market rumour or speculation"" while the UAE government did not reply to a request for comment.

Naturgy has gas contracts with Algerian state oil and gas company Sonatrach for about 5 billion cubic metres (bcm) per year, according to figures the Spanish company gave to the market in 2022. The parties are negotiating prices for 2023, retroactively, and 2024.

Algerian gas made up roughly one-third of Spain's total gas imports in the first three months of the year, according to data from Spanish gas grid operator Enagas.

The bulk of the supply comes via the Medgaz pipeline, in which Naturgy is a minority partner and Sonatrach holds a 51% stake. Sonatrach also has a stake of about 4% in Naturgy.

Naturgy hailed its more than 50-year-old relationship with Sonatrach.

""During all these years, there have been no breaches by either party. Not even in politically sensitive times on both sides of the Mediterranean have the contracts not been honoured,"" it said.

TAQA said last month it was in talks with private equity firms CVC and GIP about buying each of their 20% plus stakes in Naturgy, and also with Naturgy's largest shareholder Criteria, which owns a 26.7% stake, about a possible partnership. Criteria declined to comment on the future of Algerian gas deliveries. (Reporting by Pietro Lombardi, Lamine Chikhi, additional reporting by Belen Carreño, Jesus Aguado, Maha El Dahanm, Federico Maccioni; Editing by David Latona, Kirsten Donovan)",dailymail.co.uk,news,Daily Mail Online,,0.09019607843137245,452790082,1,,
