uri,lang,isDuplicate,date,time,dateTime,dateTimePub,dataType,sim,url,title,body,source_uri,source_dataType,source_title,authors,sentiment,wgt,relevance,image,eventUri
8140935830,eng,False,2024-05-22,19:20:09,2024-05-22T19:20:09Z,2024-05-22T19:19:35Z,news,0.0,https://born2invest.com/articles/verdalia-bioenergy-7-biomethane-plants/,Verdalia Bioenergy Buys 7 Biomethane Plants from Green Arrow,"Verdalia Bioenergy, launched by Goldman Sachs, acquired seven biomethane plants in Brescia from Green Arrow Capital and Lazzari & Lucchini. These plants produce 190 GWh of biomethane annually, eliminating 65,000 tons of greenhouse gas emissions. The acquisition supports Verdalia's European expansion, leveraging Italy's supportive regulatory framework for decarbonization and renewable energy incentives.

Verdalia Bioenergy, a platform launched by Goldman Sachs in February 2023 to invest over a billion euros in Europe in the biomethane sector by 2026, has acquired a portfolio of 7 operating plants in the Brescia area for the production of biomethane from funds controlled by Green Arrow Capital and Lazzari & Lucchini, a company specialized in the production of energy from renewable and sustainable sources.

In the operation, Green Arrow and L&L were assisted by MFZ (financial advisor), Parola & Associati (legal and regulatory aspects) while Verdalia Bioenergy was supported by Intesa Sanpaolo (for the M&A aspects), by Ashurst (for the legal aspects), by EY (for the financial and fiscal part), by Ramboll (in the technical field) and by ERM (for environmental issues).

The portfolio consists of plants with a total production capacity of approximately 190 GWh of biomethane deriving from the treatment of 350 thousand tonnes of raw materials per year, with the possibility of expanding these volumes by over 50%. The plants have come into operation over the last few years and aim to eliminate approximately 65 thousand tons of greenhouse gas emissions per year. The construction of the assets is part of the partnership, started in 2020, which now aims to double the number of plants with a second portfolio of at least six assets , which will come into operation by 2025.

The entire portfolio of these first 7 plants produces biomethane thanks to the sole recovery of livestock effluents and agricultural by-products not intended for human consumption. During 2023, the last four of the seven plants were put into operation and, last December, the project financing of the entire portfolio was finalized.

The seven plants bought by Verdalia Bioenergy, built and financed between 2020 and 2023, are incentivized pursuant to the Ministerial Decree ""Biomethane 2018"", which represented a significant step towards the promotion of renewable energy in the Italian energy sector, establishing incentives and regulations to encourage the production and use of biomethane.

In detail, the last four plants inaugurated in March were: Bio Gottolengo Solaro and CH4 Gottolengo, both located in Gottolengo; Bio Sole, located in Montichiari; and Gambaresca in Verolanuova. The three that have already been operational for some time are Bio Tre Ponti, located in Borgo San Giacomo; Bio Industria, with production of BIOGNL, and Bio Verola, both in Verolanuova.

The acquisition of the latter portfolio therefore strengthens Verdalia Bioenergy's presence in Europe in the biomethane sector on the continent, building on an infrastructure business model . All plants benefit from the incentive program established by the Ministerial Decree of 2 March 2018 and the feedstock is guaranteed through medium-long term supply contracts.

Fernando Bergasa, president and CEO of Verdalia Bioenergy, commented: ""We believe that Italy is at the forefront of the European decarbonization program through biomethane, which is based on a supportive regulatory framework , and we are proud to actively contribute to the plan energy transition of the country through this important investment.""

Matteo Botto Poala, managing director of Goldman Sachs Asset Management's infrastructure investment business, added: ""We are very happy with the progress made by Verdalia which, once again, is testament to Goldman Sachs Asset Management's track record in being a pioneer in investments for the energy transition and in the development of successful platforms. We look forward to continuing to invest in European biomethane and attracting new talent to join Verdalia's world-class management team.""

Matteo Grandi, country manager of Verdalia Italia, concluded: ""Green Arrow and L&L have developed 7 high-level biomethane plants. The acquisition of these plants represents an important starting point to launch our activities in Italy and we look to the future with optimism, continuing to work on our expansion in the country.""

Grandi, previously responsible for agricultural and agri-industrial biomethane at Snam and previously at Ladurner, was appointed last September to lead the development of Verdalia Bioenergy Italia's activities, at the same time as the announcement of the company's entry into the Italian market. Verdalia Bioenergy had conducted its first investment in Spain, coinciding with the launch of the platform in early 2023, relating to a portfolio of biomethane projects in intermediate development, with a total capacity of approximately 150 GWh/year.

Since then the company has made significant progress and now has a team of 50 people and a pipeline of mid-to-late-stage development projects in Spain and Italy with a volume of over 2.5 TWh of biomethane per year. As explained in a note from the company, Verdalia Bioenergy will continue to pursue new expansion opportunities through the acquisition of brownfield and greenfield projects , establishing partnerships with EPCs and long-term agreements with offtakers and feedstock suppliers, also thanks to the strengthening of its team.

DISCLAIMER: This article was written by a third party contributor and does not reflect the opinion of Born2Invest, its management, staff or its associates. Please review our disclaimer for more information.

This article may include forward-looking statements. These forward-looking statements generally are identified by the words ""believe,"" ""project,"" ""estimate,"" ""become,"" ""plan,"" ""will,"" and similar expressions. These forward-looking statements involve known and unknown risks as well as uncertainties, including those discussed in the following cautionary statements and elsewhere in this article and on this site. Although the Company may believe that its expectations are based on reasonable assumptions, the actual results that the Company may achieve may differ materially from any forward-looking statements, which reflect the opinions of the management of the Company only as of the date hereof. Additionally, please make sure to read these important disclosures.

First published in StartupItalia. A third-party contributor translated and adapted the article from the original. In case of discrepancy, the original will prevail.

Although we made reasonable efforts to provide accurate translations, some parts may be incorrect. Born2Invest assumes no responsibility for errors, omissions or ambiguities in the translations provided on this website. Any person or entity relying on translated content does so at their own risk. Born2Invest is not responsible for losses caused by such reliance on the accuracy or reliability of translated information. If you wish to report an error or inaccuracy in the translation, we encourage you to contact us",born2invest.com,news,Born2Invest,Jeremy Whannell,0.2470588235294118,454101609,1,https://born2invest.com/wp-content/uploads/2024/05/julia-koblitz-JJkwsqNv4d0-unsplash-e1716378642382.jpg,
8140354275,eng,True,2024-05-22,12:33:24,2024-05-22T12:33:24Z,2024-05-22T12:32:46Z,news,0.0,https://realnewsmagazine.net/29th-world-gas-conference-marks-one-year-countdown-with-exclusive-event-in-china/,29TH World Gas Conference marks one year countdown with exclusive event in China - Realnews Magazine,"THE World Gas Conference 2025, WGC2025, marks a significant milestone on Tuesday, announcing one year until the highly anticipated event in Beijing, China on 19-23 May 2025.

To mark this occasion, an exclusive one-year countdown event was held at the China National Convention Center in Beijing. The President and the Secretary General of the International Gas Union, IGU, the President of Eurogas, and other industry leaders attended the event and delivered speeches to energy professionals from across the globe.

Jointly organised by the IGU, Beijing Gas, and Beijing Capital Group Exhibitions & Events, BCGEE, the WGC2025 one-year countdown event and the IGU Gas Industry's Development Forum brought together more than 400 industry pioneers and energy professionals from global industry associations, think tanks, research institutions and leading energy companies. Additionally, thousands of participants joined online through live streaming.

Li Yalan expressed her excitement, stating, ""We are thrilled to mark one year until WGC2025 with this exclusive event in Beijing. This prestigious conference and exhibition promises to ignite excitement, passion, and anticipation. We look forward to bringing together leaders to discuss critical issues, make connections, and pave the way for a sustainable future.""

""The one-year countdown event marks the most important prelude in China to WGC2025 and this triennial flagship event presented by the IGU, will make history as the first-ever World Gas Conference to be held in China. Anticipating over 30,000 participants from 70+ countries and regions across various gas and energy sectors, including policymakers, business leaders, decision-makers, customers, NGOs, media, and financial professionals.

The conference will feature 500+ speakers in approximately 100 sessions across a 4-day programme, under the theme Energising a Sustainable Future. With over 90 years of IGU history, this premier gas and energy event will showcase China's global leadership in natural gas growth potential,"" Li added.

The one-year countdown event featured the IGU Gas Industry's Development Forum where experts shared their insights and views on gas and energy in the context of climate change, energy transition, and energy investment from both global and regional perspectives. They emphasised that natural gas, as a clean and efficient energy source, will continue to play a crucial role in the future energy system.

The integration of natural gas and renewable energy resources was highlighted as a key development direction for the industry. Additionally, they stressed the need for investment in the sustainable development of the global gas industry, the importance of accelerating low-carbon transformation, and the necessity of further strengthening methane emission control.

The day also featured a registration opening ceremony, the unveiling of speakers and sponsors, and exhibitor announcements, offering a glimpse into the insightful and pioneering discussions and networking opportunities.

WGC2025 is proud to announce an impressive line-up of speakers, including DAI Houliang of China National Petroleum Corporation and PetroChina, H.E. Saad Sherida AL-KAABI of the State of Qatar and QatarEnergy, LI Yalan of the IGU, FU Chengyu of China International Council for Promotion of Multinational Corporations, Michael LEWIS of Uniper, SUN Xiansheng of the International Society for Energy Transition Studies (ISETS), Andrea STEGHER of SNAM and the IGU, LI Junfeng of the China Energy Research Society (CERS) and the National Center for Climate Change Strategy and International Cooperation (NCSC), Sarah BAIRSTOW of Mexico Pacific and HUANG Weihe of the Chinese Academy of Engineering, each bringing invaluable insights and expertise to the conference. Prominent sponsors like CNPC, SINOPEC, CNOOC further emphasise commitment to advancing the global gas and energy sector.

WGC2025 promises an authentic, top-tier experience, offering unparalleled networking opportunities within the global gas and energy industry. Over 300 energy-related companies will showcase their innovations at the China National Convention Center Phase 2, providing a platform to discuss critical issues, make connections, and pave the way for a sustainable future.

With the Call for Abstracts underway, attendees from across the world are invited to speak in Beijing and be at the forefront of the global gas conversation. Moreover, registration is open, offering delegates the opportunity to secure their pass for one of the most prestigious gatherings in the global gas and energy industry. For more information, visit www.wgc2025.com",realnewsmagazine.net,news,Realnews Magazine,,0.3098039215686275,454077204,1,https://realnewsmagazine.net/wp-content/uploads/2024/05/image-1027.png,
8139272707,eng,False,2024-05-21,21:30:53,2024-05-21T21:30:53Z,2024-05-21T21:29:22Z,news,0.0,https://www.hellenicshippingnews.com/the-29th-world-gas-conference-wgc2025-marks-one-year-countdown-with-exclusive-event-in-beijing-china/,"The 29th World Gas Conference (WGC2025) marks one year countdown with exclusive event in Beijing, China","Today, the World Gas Conference 2025 (WGC2025) marks a significant milestone, announcing one year until the highly anticipated event in Beijing, China on 19-23 May 2025. To mark this occasion, an exclusive one-year countdown event was held at the China National Convention Center in Beijing. The President and the Secretary General of the International Gas Union (IGU), the President of Eurogas, and other industry leaders attended the event and delivered speeches to energy professionals from across the globe.

Jointly organised by the IGU, Beijing Gas, and Beijing Capital Group Exhibitions & Events (BCGEE), the WGC2025 one-year countdown event and the IGU Gas Industry's Development Forum brought together more than 400 industry pioneers and energy professionals from global industry associations, think tanks, research institutions and leading energy companies. Additionally, thousands of participants joined online through live streaming.

Madam Li Yalan expressed her excitement, stating, ""We are thrilled to mark one year until WGC2025 with this exclusive event in Beijing. This prestigious conference and exhibition promises to ignite excitement, passion, and anticipation. We look forward to bringing together leaders to discuss critical issues, make connections, and pave the way for a sustainable future.""

""The one-year countdown event marks the most important prelude in China to WGC2025 and this triennial flagship event presented by the IGU, will make history as the first-ever World Gas Conference to be held in China. Anticipating over 30,000 participants from 70+ countries and regions across various gas and energy sectors, including policymakers, business leaders, decision-makers, customers, NGOs, media, and financial professionals. The conference will feature 500+ speakers in approximately 100 sessions across a 4-day programme, under the theme Energising a Sustainable Future. With over 90 years of IGU history, this premier gas and energy event will showcase China's global leadership in natural gas growth potential,"" Madam Li added.

The one-year countdown event featured the IGU Gas Industry's Development Forum where experts shared their insights and views on gas and energy in the context of climate change, energy transition, and energy investment from both global and regional perspectives. They emphasised that natural gas, as a clean and efficient energy source, will continue to play a crucial role in the future energy system. The integration of natural gas and renewable energy resources was highlighted as a key development direction for the industry. Additionally, they stressed the need for investment in the sustainable development of the global gas industry, the importance of accelerating low-carbon transformation, and the necessity of further strengthening methane emission control.

The day also featured a registration opening ceremony, the unveiling of speakers and sponsors, and exhibitor announcements, offering a glimpse into the insightful and pioneering discussions and networking opportunities. WGC2025 is proud to announce an impressive line-up of speakers, including DAI Houliang of China National Petroleum Corporation and PetroChina, H.E. Saad Sherida AL-KAABI of the State of Qatar and QatarEnergy, LI Yalan of the IGU, FU Chengyu of China International Council for Promotion of Multinational Corporations, Michael LEWIS of Uniper, SUN Xiansheng of the International Society for Energy Transition Studies (ISETS), Andrea STEGHER of SNAM and the IGU, LI Junfeng of the China Energy Research Society (CERS) and the National Center for Climate Change Strategy and International Cooperation (NCSC), Sarah BAIRSTOW of Mexico Pacific and HUANG Weihe of the Chinese Academy of Engineering, each bringing invaluable insights and expertise to the conference. Prominent sponsors like CNPC, SINOPEC, CNOOC further emphasise commitment to advancing the global gas and energy sector.

WGC2025 promises an authentic, top-tier experience, offering unparalleled networking opportunities within the global gas and energy industry. Over 300 energy-related companies will showcase their innovations at the China National Convention Center Phase 2, providing a platform to discuss critical issues, make connections, and pave the way for a sustainable future.

With the Call for Abstracts underway, attendees from across the world are invited to speak in Beijing and be at the forefront of the global gas conversation. Moreover, registration is open, offering delegates the opportunity to secure their pass for one of the most prestigious gatherings in the global gas and energy industry.

Source: WORLD GAS CONFERENCE (WGC2025)",hellenicshippingnews.com,news,Hellenic Shipping News,,0.3098039215686275,454023053,1,,
8139104803,eng,True,2024-05-21,18:49:09,2024-05-21T18:49:09Z,2024-05-21T18:47:50Z,news,0.0,https://www.fuelsandlubes.com/newswire/the-29th-world-gas-conference-wgc2025-marks-one-year-countdown-with-exclusive-event-in-beijing-china/,"THE 29TH WORLD GAS CONFERENCE (WGC2025) MARKS ONE YEAR COUNTDOWN WITH EXCLUSIVE EVENT IN BEIJING, CHINA - F&L Asia","LONDON and BEIJING, May 21, 2024 /PRNewswire/ -- Today, the World Gas Conference 2025 (WGC2025) marks a significant milestone, announcing one year until the highly anticipated event in Beijing, China on 19-23 May 2025. To mark this occasion, an exclusive one-year countdown event was held at the China National Convention Center in Beijing. The President and the Secretary General of the International Gas Union (IGU), the President of Eurogas, and other industry leaders attended the event and delivered speeches to energy professionals from across the globe.

Jointly organised by the IGU, Beijing Gas, and Beijing Capital Group Exhibitions & Events (BCGEE), the WGC2025 one-year countdown event and the IGU Gas Industry's Development Forum brought together more than 400 industry pioneers and energy professionals from global industry associations, think tanks, research institutions and leading energy companies. Additionally, thousands of participants joined online through live streaming.

Madam Li Yalan expressed her excitement, stating, ""We are thrilled to mark one year until WGC2025 with this exclusive event in Beijing. This prestigious conference and exhibition promises to ignite excitement, passion, and anticipation. We look forward to bringing together leaders to discuss critical issues, make connections, and pave the way for a sustainable future.""

""The one-year countdown event marks the most important prelude in China to WGC2025 and this triennial flagship event presented by the IGU, will make history as the first-ever World Gas Conference to be held in China. Anticipating over 30,000 participants from 70+ countries and regions across various gas and energy sectors, including policymakers, business leaders, decision-makers, customers, NGOs, media, and financial professionals. The conference will feature 500+ speakers in approximately 100 sessions across a 4-day programme, under the theme Energising a Sustainable Future. With over 90 years of IGU history, this premier gas and energy event will showcase China's global leadership in natural gas growth potential,"" Madam Li added.

The one-year countdown event featured the IGU Gas Industry's Development Forum where experts shared their insights and views on gas and energy in the context of climate change, energy transition, and energy investment from both global and regional perspectives. They emphasised that natural gas, as a clean and efficient energy source, will continue to play a crucial role in the future energy system. The integration of natural gas and renewable energy resources was highlighted as a key development direction for the industry. Additionally, they stressed the need for investment in the sustainable development of the global gas industry, the importance of accelerating low-carbon transformation, and the necessity of further strengthening methane emission control.

The day also featured a registration opening ceremony, the unveiling of speakers and sponsors, and exhibitor announcements, offering a glimpse into the insightful and pioneering discussions and networking opportunities. WGC2025 is proud to announce an impressive line-up of speakers, including DAI Houliang of China National Petroleum Corporation and PetroChina, H.E. Saad Sherida AL-KAABI of the State of Qatar and QatarEnergy, LI Yalan of the IGU, FU Chengyu of China International Council for Promotion of Multinational Corporations, Michael LEWIS of Uniper, SUN Xiansheng of the International Society for Energy Transition Studies (ISETS), Andrea STEGHER of SNAM and the IGU, LI Junfeng of the China Energy Research Society (CERS) and the National Center for Climate Change Strategy and International Cooperation (NCSC), Sarah BAIRSTOW of Mexico Pacific and HUANG Weihe of the Chinese Academy of Engineering, each bringing invaluable insights and expertise to the conference. Prominent sponsors like CNPC, SINOPEC, CNOOC further emphasise commitment to advancing the global gas and energy sector.

WGC2025 promises an authentic, top-tier experience, offering unparalleled networking opportunities within the global gas and energy industry. Over 300 energy-related companies will showcase their innovations at the China National Convention Center Phase 2, providing a platform to discuss critical issues, make connections, and pave the way for a sustainable future.

With the Call for Abstracts underway, attendees from across the world are invited to speak in Beijing and be at the forefront of the global gas conversation. Moreover, registration is open, offering delegates the opportunity to secure their pass for one of the most prestigious gatherings in the global gas and energy industry. For more information, visit www.wgc2025.com",fuelsandlubes.com,news,F&L Asia,,0.3098039215686275,454013349,1,,
8139043290,eng,False,2024-05-21,17:58:35,2024-05-21T17:58:35Z,2024-05-21T17:57:44Z,news,0.0,https://www.marketscreener.com/quote/stock/SNAM-S-P-A-95732/news/Snam-S-p-A-Biodiversity-Policy-46786671/,Snam S p A :  Biodiversity Policy,"Snam recognizes biodiversity as a fundamental pillar of a sustainable development model. Biodiversity is essential to ensure people's health and well-being and preserve life on earth. This policy defines the commitments and actions that Snam adopts to protect biodiversity.

Snam's commitment to safeguarding biodiversity is consistent with what has already been established in its Health, Safety, Environment, Energy and Quality Policy (HSEEQ Policy) and is inspired by the main national and international guidelines and strategic plans on the subject. In particular, Snam's Policy refers to the Convention on Biological Diversity (CBD) adopted in 1992, the United Nations 2030 Agenda, in particular the goal 15 ""Life on Earth"", the EU's 2020 Biodiversity Strategy, the Kunming-Montreal Global Biodiversity Framework adopted in 2022 during COP 15, and the National Biodiversity Strategy adopted in 2023.

Snam is a company that operates in the transport, storage and regasification of natural gas. The company manages a network of gas pipelines that extensively covers the national territory, owns storage facilities that contribute to the country's energy security and operates through regasification plants to ensure the diversification of energy supplies. To consolidate its role as an enabler of the energy transition and with the aim of contributing to the decarbonization of the country, Snam has developed new business lines over the years related to the production of biomethane, energy efficiency, sustainable mobility, the development of hydrogen and Carbon Capture & Storage (CCS) technologies.

In line with the principles it commits to adhere to, Snam has developed over time an approach for the management of its infrastructure, from the design phase to the decommissioning phase, based on key principles that express a rigorous application of the hierarchy of mitigation of its impacts on the environment and biodiversity. In particular, the principles followed by Snam are as follows:

Following this approach, Snam, for its linear gas transport infrastructures, has been operating for some time in a regime of substantial Zero Net Conversion in the construction and maintenance activities of the infrastructures, neutralizing the impacts resulting from the change in land use caused by its operations through the restoration by reforestation of the occupied areas (no net deforestation).",marketscreener.com,news,Market Screener,,0.4901960784313726,454010315,48,,
