uri,lang,isDuplicate,date,time,dateTime,dateTimePub,dataType,sim,url,title,body,source_uri,source_dataType,source_title,authors,sentiment,wgt,relevance,image,eventUri
8130901020,eng,False,2024-05-16,14:56:27,2024-05-16T14:56:27Z,2024-05-16T14:55:56Z,news,0.0,https://www.benzinga.com/pressreleases/24/05/n38875320/ev-battery-recycling-market-to-be-worth-10-1-billion-by-2031-exclusive-report-by-meticulous-resear,EV Battery Recycling Market to be Worth $10.1 Billion by 2031 - Exclusive Report by Meticulous Research®,"REDDING, Calif., May 16, 2024 /PRNewswire/ --According to a new market research report titled, 'EV Battery Recycling Market by Type (Li-ion, Ni-MH, SLA), Source (Commercial, Passenger, E-bikes), Process (Direct, Pyro, Hydro), Model (Contractual Services, Direct-to-Market), Material (Graphite, Lithium), and Geography -- Global Forecast to 2031,' the electric vehicles (EVs) battery recycling market is expected to reach $10.1 billion by 2031, at a CAGR of 40.9% from 2024 to 2031.

Download Sample Report Now- https://www.meticulousresearch.com/download-sample-report/cp_id=5483

EV battery recycling is the process of recovering materials such as graphite, nickel, cobalt, copper, manganese, lithium, aluminum, and other valuable metals from used EV batteries. The need for sustainable solutions for the disposal of used batteries due to the popularity of electric vehicles continues to grow. Recycling helps reduce the environmental impact of EV battery waste and reduce waste, conserving resources. The valuable materials extracted from EV batteries can be sold and used in new battery production, reducing the need for mining and processing new materials.

The growth of this market is mainly driven by the stringent government regulatory framework, growing demand for EVs, and rising concerns regarding the depletion of raw materials required for EV battery production. Additionally, the surging government incentives for battery recycling and growing innovations in recycling technologies are expected to create market growth opportunities.

However, safety concerns due to the use of hazardous materials in batteries may restrain the growth of this market. The high setup cost of battery recycling plants and lower recovery rates through battery recycling processes are major challenges for the players operating in the electric vehicles battery recycling market.

The EV battery recycling market is segmented by battery type (lithium-ion batteries (Li-ion), sealed lead acid batteries (SLA), nickel-metal hydride batteries (Ni-MH), other batteries), battery source (commercial vehicles (heavy commercial vehicles, light commercial vehicles), passenger cars (battery electric vehicles, pure hybrid electric vehicles, plug-in hybrid electric vehicles), e-scooters & motorcycles, E-bikes), recycling process (direct physical recycling process, pyrometallurgical process, hydrometallurgical process, and other recycling processes), business model (contractual recycling services and direct-to-market), material (graphite, nickel, cobalt, copper, manganese, lithium, aluminum, iron, plastics, and other materials), and geography. The study also evaluates industry competitors and analyses the market at the regional and country levels.

Get a Glimpse Inside: Request Sample Pages- https://www.meticulousresearch.com/request-sample-report/cp_id=5483

Based on battery type, the global EV battery recycling market is broadly segmented into lithium-ion batteries (Li-ion), sealed lead acid batteries (SLA), nickel-metal hydride batteries (Ni-MH), and other batteries. In 2024, the lithium-ion batteries segment is expected to account for the largest share of 78.3% of the EV battery recycling market. The large market share of this segment is mainly attributed to the rising need to recover valuable materials from Li-ion batteries to reduce the need for new mining and processing of raw materials, the increasing adoption of electric vehicles, and the growing demand for high energy density and low self-discharge rate batteries for EVs. This segment is also projected to register the highest CAGR during the forecast period.

Based on battery source, the global EV battery recycling market is broadly segmented into commercial vehicles, passenger cars, e-scooters & motorcycles, and E-bikes. In 2024, the E-bikes segment is expected to account for the largest share of 64.8% of the EV battery recycling market. The large market share of this segment is attributed to the rising adoption of e-bikes worldwide. However, the commercial vehicles segment is expected to record the highest CAGR during the forecast period.

Based on recycling process, the global EV battery recycling market is broadly segmented into direct physical recycling process, pyrometallurgical process, hydrometallurgical process, and other recycling processes. In 2024, the pyrometallurgical process segment is expected to account for the largest share of the global EV battery recycling market. The large market share of this segment is mainly attributed to the increasing need to extract raw materials from battery waste, the rising need for efficient and effective recycling processes, growing demand for a scalable, flexible, and low environmental impact recycling process. However, the hydrometallurgical process segment is projected to register the highest CAGR during the forecast period.

Have Specific Research Needs? Request a Customized Report-

https://www.meticulousresearch.com/request-customization/cp_id=5483

Based on business model, the global EV battery recycling market is broadly segmented into contractual recycling services and direct-to-market. In 2024, the contractual recycling services segment is expected to account for the larger share of 86% of the EV battery recycling market. The large market share of this segment is mainly attributed to the increasing government incentives for battery recycling, stringent laws for the recycling of EV batteries, the increasing revenue streams for companies involved in the EV battery recycling market, and the growing need to reduce the cost of raw materials for new Electric Vehicle batteries. This segment is also projected to register the higher CAGR during the forecast period.

Based on material, the global EV battery recycling market is broadly segmented into graphite, nickel, cobalt, copper, manganese, lithium, aluminum, iron, plastics, and other materials. In 2024, the graphite segment is expected to account for the largest share of the global EV battery recycling market. The large market share of this segment is mainly attributed to the increasing use of graphite in the anodes of batteries for electric vehicles, the high recycling rate of sealed lead acid batteries (SLA), and the increasing need to recover valuable materials from used EV batteries to reduce the need for mining new raw materials. However, the lithium segment is projected to register the highest CAGR during the forecast period.

Based on geography, the global EV battery recycling market is segmented into North America, Europe, Asia-Pacific, Latin America, and the Middle East & Africa. In 2024, Asia-Pacific is expected to account for the largest share of the 69% of the EV battery recycling market, followed by Europe and North America. Asia-Pacific's significant market share is mainly attributed to the growing implementation of policies and initiatives to reduce the amount of EV battery waste and toxic substances in the environment, the rising concerns regarding the depletion of precious and rare earth metals, the growing demand for lithium-ion batteries, the increasing, and the high adoption of electric mobility in the region.

The report also includes an extensive assessment of the key growth strategies adopted by the leading market participants in the last three to four years. The key players operating in the EV battery recycling market are Glencore plc (Switzerland), Fortum Corporation (Finland), Umicore NV (Belgium), Li-Cycle Holdings Corp. (Canada), Lithion Recycling Inc. (Canada), Tata Chemicals Limited (India), SNAM S.A.S. (France), Ascend Elements, Inc. (U.S.), ACE Green Recycling, Inc. (Singapore), Redwood Materials, Inc. (U.S.), Primobius GmbH (Germany), Attero Recycling Pvt. Lyd. (India), ACCUREC Recycling GmbH (Germany), Trishulavel Eshan Pvt. Ltd. (India), BatX Energies Pvt. Ltd. (India), MTB GROUP (France), and Duesenfeld GmbH (Germany).

Browse the In-depth Report- https://www.meticulousresearch.com/product/ev-battery-recycling-market-5483

Scope of the report:

EV Battery Recycling Market Assessment -- by Battery Type

Lithium-ion BatteriesSealed Lead Acid BatteriesNickel-Metal Hydride BatteriesOther Batteries

EV Battery Recycling Market Assessment -- by Battery Source

Commercial VehiclesHeavy Commercial VehiclesLight Commercial VehiclesPassenger CarsBattery Electric VehiclesPlug-In Hybrid Electric VehiclesPure Hybrid Electric VehiclesE-Scooters & MotorcyclesE-Bikes

EV Battery Recycling Market Assessment -- by Recycling Process

Direct Physical Recycling ProcessPyrometallurgical ProcessHydrometallurgical ProcessOther Recycling Processes

EV Battery Recycling Market Assessment -- by Business Model

Contractual Recycling ServicesDirect-to-Market

EV Battery Recycling Market Assessment -- by Material

GraphiteNickelCobaltCopperManganeseLithiumAluminumIronPlasticsOther Materials

EV Battery Recycling Market Assessment -- by Geography

North AmericaU.S.CanadaEuropeGermanyU.K.FranceItalySpainSwitzerlandBelgiumNorwayPolandFinlandRest of EuropeAsia-PacificJapanChinaIndiaSouth KoreaSingaporeAustralia & New ZealandMalaysiaRest of Asia-PacificLatin AmericaBrazilMexicoRest of Latin AmericaMiddle East & AfricaUAESaudi ArabiaRest of the Middle East & Africa

Unlock Opportunities: Buy Now- https://www.meticulousresearch.com/Checkout/45013298

Related Report:

Electric Vehicle (EV) Market - Global Opportunity Analysis and Industry Forecast (2023-2030)

Electric Vehicle Battery Market- Global Opportunity Analysis and Industry Forecast (2021-2028)

Black Mass Recycling Market - Global Opportunity Analysis And Industry Forecast (2023-2030)

Li-ion Battery Recycling Market - Global Opportunity Analysis And Industry Forecast (2023-2030)

Related Reports

Top 10 Companies in EV Battery Recycling Market

EV Battery Recycling: A Comprehensive Look at Direct, Pyro, Hydro, and Other Processes

About Meticulous Research®

Meticulous Research® was founded in 2010 and incorporated as Meticulous Market Research Pvt. Ltd. in 2013 as a private limited company under the Companies Act, 1956. Since its incorporation, the company has become the leading provider of premium market intelligence in North America, Europe, Asia-Pacific, Latin America, and the Middle East & Africa.

The name of our company defines our services, strengths, and values. Since the inception, we have only thrived to research, analyze, and present the critical market data with great attention to details. With the meticulous primary and secondary research techniques, we have built strong capabilities in data collection, interpretation, and analysis of data including qualitative and quantitative research with the finest team of analysts. We design our meticulously analyzed intelligent and value-driven syndicate market research reports, custom studies, quick turnaround research, and consulting solutions to address business challenges of sustainable growth.

Mr. Khushal Bombe

Meticulous Market Research Inc.

1267 Willis St, Ste 200 Redding,

California, 96001, U.S.

USA: +1-646-781-8004

Europe : +44-203-868-8738

APAC: +91 744-7780008

Email- sales@meticulousresearch.com

Visit Our Website: https://www.meticulousresearch.com

Connect with us on LinkedIn- https://www.linkedin.com/company/meticulous-research

Content Source: https://www.meticulousresearch.com/pressrelease/714/ev-battery-recycling-market-2031

Logo: https://mma.prnewswire.com/media/1757980/Meticulous_Research_Logo_1.jpg

SOURCE Meticulous Market Research Pvt. Ltd.

Market News and Data brought to you by Benzinga APIs",benzinga.com,news,Benzinga,,0.2862745098039217,453567387,1,https://www.benzinga.com/next-assets/images/schema-image-default.png,
8130898232,eng,False,2024-05-16,14:54:28,2024-05-16T14:54:28Z,2024-05-16T14:54:06Z,news,0.0,https://www.finanznachrichten.de/nachrichten-2024-05/62255052-meticulous-market-research-pvt-ltd-ev-battery-recycling-market-to-be-worth-dollar-10-1-billion-by-2031-exclusive-report-by-meticulous-research-008.htm,Meticulous Market Research Pvt. Ltd.: EV Battery Recycling Market to be Worth $10.1 Billion by 2031 - Exclusive Report by Meticulous Research®,"REDDING, Calif., May 16, 2024 /PRNewswire/ --According to a new market research report titled, 'EV Battery Recycling Market by Type (Li-ion, Ni-MH, SLA), Source (Commercial, Passenger, E-bikes), Process (Direct, Pyro, Hydro), Model (Contractual Services, Direct-to-Market), Material (Graphite, Lithium), and Geography-Global Forecast to 2031,' the electric vehicles (EVs) battery recycling market is expected to reach $10.1 billion by 2031, at a CAGR of 40.9% from 2024 to 2031.

Download Sample Report Now- https://www.meticulousresearch.com/download-sample-report/cp_id=5483

EV battery recycling is the process of recovering materials such as graphite, nickel, cobalt, copper, manganese, lithium, aluminum, and other valuable metals from used EV batteries. The need for sustainable solutions for the disposal of used batteries due to the popularity of electric vehicles continues to grow. Recycling helps reduce the environmental impact of EV battery waste and reduce waste, conserving resources. The valuable materials extracted from EV batteries can be sold and used in new battery production, reducing the need for mining and processing new materials.

The growth of this market is mainly driven by the stringent government regulatory framework, growing demand for EVs, and rising concerns regarding the depletion of raw materials required for EV battery production. Additionally, the surging government incentives for battery recycling and growing innovations in recycling technologies are expected to create market growth opportunities.

However, safety concerns due to the use of hazardous materials in batteries may restrain the growth of this market. The high setup cost of battery recycling plants and lower recovery rates through battery recycling processes are major challenges for the players operating in the electric vehicles battery recycling market.

The EV battery recycling market is segmented by battery type (lithium-ion batteries (Li-ion), sealed lead acid batteries (SLA), nickel-metal hydride batteries (Ni-MH), other batteries), battery source (commercial vehicles (heavy commercial vehicles, light commercial vehicles), passenger cars (battery electric vehicles, pure hybrid electric vehicles, plug-in hybrid electric vehicles), e-scooters & motorcycles, E-bikes), recycling process (direct physical recycling process, pyrometallurgical process, hydrometallurgical process, and other recycling processes), business model (contractual recycling services and direct-to-market), material (graphite, nickel, cobalt, copper, manganese, lithium, aluminum, iron, plastics, and other materials), and geography. The study also evaluates industry competitors and analyses the market at the regional and country levels.

Get a Glimpse Inside: Request Sample Pages- https://www.meticulousresearch.com/request-sample-report/cp_id=5483

Based on battery type, the global EV battery recycling market is broadly segmented into lithium-ion batteries (Li-ion), sealed lead acid batteries (SLA), nickel-metal hydride batteries (Ni-MH), and other batteries. In 2024, the lithium-ion batteries segment is expected to account for the largest share of 78.3% of the EV battery recycling market. The large market share of this segment is mainly attributed to the rising need to recover valuable materials from Li-ion batteries to reduce the need for new mining and processing of raw materials, the increasing adoption of electric vehicles, and the growing demand for high energy density and low self-discharge rate batteries for EVs. This segment is also projected to register the highest CAGR during the forecast period.

Based on battery source, the global EV battery recycling market is broadly segmented into commercial vehicles, passenger cars, e-scooters & motorcycles, and E-bikes. In 2024, the E-bikes segment is expected to account for the largest share of 64.8% of the EV battery recycling market. The large market share of this segment is attributed to the rising adoption of e-bikes worldwide. However, the commercial vehicles segment is expected to record the highest CAGR during the forecast period.

Based on recycling process, the global EV battery recycling market is broadly segmented into direct physical recycling process, pyrometallurgical process, hydrometallurgical process, and other recycling processes. In 2024, the pyrometallurgical process segment is expected to account for the largest share of the global EV battery recycling market. The large market share of this segment is mainly attributed to the increasing need to extract raw materials from battery waste, the rising need for efficient and effective recycling processes, growing demand for a scalable, flexible, and low environmental impact recycling process. However, the hydrometallurgical process segment is projected to register the highest CAGR during the forecast period.

Have Specific Research Needs? Request a Customized Report-

https://www.meticulousresearch.com/request-customization/cp_id=5483

Based on business model, the global EV battery recycling market is broadly segmented into contractual recycling services and direct-to-market. In 2024, the contractual recycling services segment is expected to account for the larger share of 86% of the EV battery recycling market. The large market share of this segment is mainly attributed to the increasing government incentives for battery recycling, stringent laws for the recycling of EV batteries, the increasing revenue streams for companies involved in the EV battery recycling market, and the growing need to reduce the cost of raw materials for new Electric Vehicle batteries. This segment is also projected to register the higher CAGR during the forecast period.

Based on material, the global EV battery recycling market is broadly segmented into graphite, nickel, cobalt, copper, manganese, lithium, aluminum, iron, plastics, and other materials. In 2024, the graphite segment is expected to account for the largest share of the global EV battery recycling market. The large market share of this segment is mainly attributed to the increasing use of graphite in the anodes of batteries for electric vehicles, the high recycling rate of sealed lead acid batteries (SLA), and the increasing need to recover valuable materials from used EV batteries to reduce the need for mining new raw materials. However, the lithium segment is projected to register the highest CAGR during the forecast period.

Based on geography, the global EV battery recycling market is segmented into North America, Europe, Asia-Pacific, Latin America, and the Middle East & Africa. In 2024, Asia-Pacific is expected to account for the largest share of the 69% of the EV battery recycling market, followed by Europe and North America. Asia-Pacific's significant market share is mainly attributed to the growing implementation of policies and initiatives to reduce the amount of EV battery waste and toxic substances in the environment, the rising concerns regarding the depletion of precious and rare earth metals, the growing demand for lithium-ion batteries, the increasing, and the high adoption of electric mobility in the region.

The report also includes an extensive assessment of the key growth strategies adopted by the leading market participants in the last three to four years. The key players operating in the EV battery recycling market are Glencore plc (Switzerland), Fortum Corporation (Finland), Umicore NV (Belgium), Li-Cycle Holdings Corp. (Canada), Lithion Recycling Inc. (Canada), Tata Chemicals Limited (India), SNAM S.A.S. (France), Ascend Elements, Inc. (U.S.), ACE Green Recycling, Inc. (Singapore), Redwood Materials, Inc. (U.S.), Primobius GmbH (Germany), Attero Recycling Pvt. Lyd. (India), ACCUREC Recycling GmbH (Germany), Trishulavel Eshan Pvt. Ltd. (India), BatX Energies Pvt. Ltd. (India), MTB GROUP (France), and Duesenfeld GmbH (Germany).

Browse the In-depth Report- https://www.meticulousresearch.com/product/ev-battery-recycling-market-5483

Scope of the report:

EV Battery Recycling Market Assessment-by Battery Type

Lithium-ion BatteriesSealed Lead Acid BatteriesNickel-Metal Hydride BatteriesOther Batteries

EV Battery Recycling Market Assessment-by Battery Source

Commercial VehiclesHeavy Commercial VehiclesLight Commercial VehiclesPassenger CarsBattery Electric VehiclesPlug-In Hybrid Electric VehiclesPure Hybrid Electric VehiclesE-Scooters & MotorcyclesE-Bikes

EV Battery Recycling Market Assessment-by Recycling Process

Direct Physical Recycling ProcessPyrometallurgical ProcessHydrometallurgical ProcessOther Recycling Processes

EV Battery Recycling Market Assessment-by Business Model

Contractual Recycling ServicesDirect-to-Market

EV Battery Recycling Market Assessment-by Material

GraphiteNickelCobaltCopperManganeseLithiumAluminumIronPlasticsOther Materials

EV Battery Recycling Market Assessment-by Geography

North AmericaU.S.CanadaEuropeGermanyU.K.FranceItalySpainSwitzerlandBelgiumNorwayPolandFinlandRest of EuropeAsia-PacificJapanChinaIndiaSouth KoreaSingaporeAustralia & New ZealandMalaysiaRest of Asia-PacificLatin AmericaBrazilMexicoRest of Latin AmericaMiddle East & AfricaUAESaudi ArabiaRest of the Middle East & Africa

Unlock Opportunities: Buy Now- https://www.meticulousresearch.com/Checkout/45013298

Related Report:

Electric Vehicle (EV) Market - Global Opportunity Analysis and Industry Forecast (2023-2030)

Electric Vehicle Battery Market- Global Opportunity Analysis and Industry Forecast (2021-2028)

Black Mass Recycling Market - Global Opportunity Analysis And Industry Forecast (2023-2030)

Li-ion Battery Recycling Market - Global Opportunity Analysis And Industry Forecast (2023-2030)

Related Reports

Top 10 Companies in EV Battery Recycling Market

EV Battery Recycling: A Comprehensive Look at Direct, Pyro, Hydro, and Other Processes

About Meticulous Research®

Meticulous Research® was founded in 2010 and incorporated as Meticulous Market Research Pvt. Ltd. in 2013 as a private limited company under the Companies Act, 1956. Since its incorporation, the company has become the leading provider of premium market intelligence in North America, Europe, Asia-Pacific, Latin America, and the Middle East & Africa.

The name of our company defines our services, strengths, and values. Since the inception, we have only thrived to research, analyze, and present the critical market data with great attention to details. With the meticulous primary and secondary research techniques, we have built strong capabilities in data collection, interpretation, and analysis of data including qualitative and quantitative research with the finest team of analysts. We design our meticulously analyzed intelligent and value-driven syndicate market research reports, custom studies, quick turnaround research, and consulting solutions to address business challenges of sustainable growth.

Contact:

Mr. Khushal Bombe

Meticulous Market Research Inc.

1267 Willis St, Ste 200 Redding,

California, 96001, U.S.

USA: +1-646-781-8004

Europe: +44-203-868-8738

APAC: +91 744-7780008

Email- sales@meticulousresearch.com

Visit Our Website: https://www.meticulousresearch.com

Connect with us on LinkedIn- https://www.linkedin.com/company/meticulous-research

Content Source: https://www.meticulousresearch.com/pressrelease/714/ev-battery-recycling-market-2031

Logo: https://mma.prnewswire.com/media/1757980/Meticulous_Research_Logo_1.jpg

View original content:https://www.prnewswire.co.uk/news-releases/ev-battery-recycling-market-to-be-worth-10-1-billion-by-2031---exclusive-report-by-meticulous-research-302147751.html",finanznachrichten.de,news,FinanzNachrichten.de,,0.2862745098039217,453567268,1,https://rt.prnewswire.com/rt.gif?NewsItemId=EN16451&Transmission_Id=202405161046PR_NEWS_EURO_ND__EN16451&DateId=20240516,
